{
  "$schema": "http://json-schema.org/draft-07/schema#",
  "$id": "https://github.com/metill-is/sports/config/publish-schemas/points_distribution.schema.json",
  "title": "data/publish/.../points_distribution.json",
  "description": "Refused outright, not merely optional. Measured on season 2026 the four basketball cells qualify 8 of 12, 8 of 12, 10 of 10 and 4 of 11 teams for the post-season -- four cells, four structures, one of which takes every team through -- and the league table decides the deildarmeistari while the Islandsmeistari comes out of an urslitakeppni this model does not simulate. A p_top_six or p_winner here would be a top-six number wearing a playoff label (design D3), so the contract rejects it rather than tolerating it. p_relegation is OPTIONAL rather than required: `relegation_slots` is unconfigured on all eight basketball and handball cells (no KKI or HSI regulation was resolved), and for a bottom-tier division -- basketball 1. deild, handball Grill 66 -- nothing is relegated at all, so football's hardcoded bottom-two rule would publish a Fallhaetta headline that is false rather than merely uncertain. The producer emits the key exactly where the division configures the number, mirroring p_qualify (ID-B15); configuring relegation_slots is what turns it on.",
  "type": "object",
  "required": [
    "generated_at",
    "season",
    "records",
    "summary"
  ],
  "properties": {
    "generated_at": {
      "type": "string",
      "pattern": "^\\d{4}-\\d{2}-\\d{2}T"
    },
    "season": {
      "type": "integer",
      "minimum": 2000
    },
    "records": {
      "type": "array",
      "items": {
        "type": "object",
        "required": [
          "team",
          "points",
          "probability"
        ],
        "properties": {
          "team": {
            "type": "string",
            "minLength": 1
          },
          "points": {
            "type": "integer",
            "minimum": 0
          },
          "probability": {
            "type": "number",
            "minimum": 0,
            "maximum": 1
          }
        }
      }
    },
    "summary": {
      "type": "array",
      "items": {
        "type": "object",
        "required": [
          "team",
          "mean_points",
          "median_points",
          "lower_80",
          "upper_80",
          "base_points",
          "p_top_of_table"
        ],
        "properties": {
          "team": {
            "type": "string",
            "minLength": 1
          },
          "mean_points": {
            "type": "number"
          },
          "median_points": {
            "type": "number"
          },
          "lower_80": {
            "type": "number"
          },
          "upper_80": {
            "type": "number"
          },
          "base_points": {
            "type": "number"
          },
          "p_top_six": false,
          "p_winner": false,
          "p_relegation": {
            "type": "number",
            "minimum": 0,
            "maximum": 1
          },
          "p_top_of_table": {
            "type": "number",
            "minimum": 0,
            "maximum": 1,
            "description": "Probability of finishing first in the table this cell publishes; see meta.season_scope for what that table is. There is deliberately no top-level `basis` here -- read it from meta.season_scope."
          }
        }
      }
    }
  }
}
