{"generated_at":"2026-10-29T15:18:56+0000","season":2026,"records":[{"team":"Aþena","points":34,"probability":1},{"team":"Fjölnir","points":30,"probability":1},{"team":"KV","points":4,"probability":1},{"team":"Njardvik b","points":10,"probability":1},{"team":"Selfoss","points":24,"probability":1},{"team":"Snæfell","points":16,"probability":1},{"team":"Stjarnan b","points":12,"probability":1},{"team":"Vestri","points":0,"probability":1},{"team":"ÍR","points":18,"probability":1},{"team":"Þór Ak.","points":30,"probability":1}],"summary":[{"team":"Aþena","mean_points":34,"median_points":34,"lower_80":34,"upper_80":34,"base_points":34,"p_top_of_table":1},{"team":"Fjölnir","mean_points":30,"median_points":30,"lower_80":30,"upper_80":30,"base_points":30,"p_top_of_table":0},{"team":"KV","mean_points":4,"median_points":4,"lower_80":4,"upper_80":4,"base_points":4,"p_top_of_table":0},{"team":"Njardvik b","mean_points":10,"median_points":10,"lower_80":10,"upper_80":10,"base_points":10,"p_top_of_table":0},{"team":"Selfoss","mean_points":24,"median_points":24,"lower_80":24,"upper_80":24,"base_points":24,"p_top_of_table":0},{"team":"Snæfell","mean_points":16,"median_points":16,"lower_80":16,"upper_80":16,"base_points":16,"p_top_of_table":0},{"team":"Stjarnan b","mean_points":12,"median_points":12,"lower_80":12,"upper_80":12,"base_points":12,"p_top_of_table":0},{"team":"Vestri","mean_points":0,"median_points":0,"lower_80":0,"upper_80":0,"base_points":0,"p_top_of_table":0},{"team":"ÍR","mean_points":18,"median_points":18,"lower_80":18,"upper_80":18,"base_points":18,"p_top_of_table":0},{"team":"Þór Ak.","mean_points":30,"median_points":30,"lower_80":30,"upper_80":30,"base_points":30,"p_top_of_table":0}]}
