{"generated_at":"2026-10-14T23:20:37+0000","season":2027,"records":[{"team":"Fjölnir","points":0,"probability":0.21425},{"team":"Fjölnir","points":2,"probability":0.2775},{"team":"Fjölnir","points":4,"probability":0.23},{"team":"Fjölnir","points":6,"probability":0.13775},{"team":"Fjölnir","points":8,"probability":0.08075},{"team":"Fjölnir","points":10,"probability":0.036},{"team":"Fjölnir","points":12,"probability":0.01475},{"team":"Fjölnir","points":14,"probability":0.0045},{"team":"Fjölnir","points":16,"probability":0.003},{"team":"Fjölnir","points":18,"probability":0.001},{"team":"Fjölnir","points":20,"probability":0.0005},{"team":"Grindavík","points":14,"probability":0.00025},{"team":"Grindavík","points":16,"probability":0.0025},{"team":"Grindavík","points":18,"probability":0.005},{"team":"Grindavík","points":20,"probability":0.0155},{"team":"Grindavík","points":22,"probability":0.02475},{"team":"Grindavík","points":24,"probability":0.049},{"team":"Grindavík","points":26,"probability":0.081},{"team":"Grindavík","points":28,"probability":0.129},{"team":"Grindavík","points":30,"probability":0.1795},{"team":"Grindavík","points":32,"probability":0.204},{"team":"Grindavík","points":34,"probability":0.2025},{"team":"Grindavík","points":36,"probability":0.107},{"team":"Haukar","points":4,"probability":0.002},{"team":"Haukar","points":6,"probability":0.00625},{"team":"Haukar","points":8,"probability":0.0155},{"team":"Haukar","points":10,"probability":0.03675},{"team":"Haukar","points":12,"probability":0.05925},{"team":"Haukar","points":14,"probability":0.1125},{"team":"Haukar","points":16,"probability":0.122},{"team":"Haukar","points":18,"probability":0.14275},{"team":"Haukar","points":20,"probability":0.15325},{"team":"Haukar","points":22,"probability":0.1285},{"team":"Haukar","points":24,"probability":0.0965},{"team":"Haukar","points":26,"probability":0.069},{"team":"Haukar","points":28,"probability":0.0415},{"team":"Haukar","points":30,"probability":0.01225},{"team":"Haukar","points":32,"probability":0.002},{"team":"KR","points":6,"probability":0.001},{"team":"KR","points":8,"probability":0.00525},{"team":"KR","points":10,"probability":0.01675},{"team":"KR","points":12,"probability":0.0395},{"team":"KR","points":14,"probability":0.069},{"team":"KR","points":16,"probability":0.11575},{"team":"KR","points":18,"probability":0.146},{"team":"KR","points":20,"probability":0.1575},{"team":"KR","points":22,"probability":0.16},{"team":"KR","points":24,"probability":0.1215},{"team":"KR","points":26,"probability":0.085},{"team":"KR","points":28,"probability":0.04875},{"team":"KR","points":30,"probability":0.023},{"team":"KR","points":32,"probability":0.0085},{"team":"KR","points":34,"probability":0.0025},{"team":"Keflavík","points":4,"probability":0.00025},{"team":"Keflavík","points":6,"probability":0.00325},{"team":"Keflavík","points":8,"probability":0.00775},{"team":"Keflavík","points":10,"probability":0.02125},{"team":"Keflavík","points":12,"probability":0.044},{"team":"Keflavík","points":14,"probability":0.073},{"team":"Keflavík","points":16,"probability":0.10525},{"team":"Keflavík","points":18,"probability":0.14775},{"team":"Keflavík","points":20,"probability":0.153},{"team":"Keflavík","points":22,"probability":0.147},{"team":"Keflavík","points":24,"probability":0.1355},{"team":"Keflavík","points":26,"probability":0.09075},{"team":"Keflavík","points":28,"probability":0.0455},{"team":"Keflavík","points":30,"probability":0.02025},{"team":"Keflavík","points":32,"probability":0.0055},{"team":"Njarðvík","points":8,"probability":0.0005},{"team":"Njarðvík","points":10,"probability":0.00075},{"team":"Njarðvík","points":12,"probability":0.00525},{"team":"Njarðvík","points":14,"probability":0.01275},{"team":"Njarðvík","points":16,"probability":0.03275},{"team":"Njarðvík","points":18,"probability":0.06125},{"team":"Njarðvík","points":20,"probability":0.10025},{"team":"Njarðvík","points":22,"probability":0.14325},{"team":"Njarðvík","points":24,"probability":0.18625},{"team":"Njarðvík","points":26,"probability":0.164},{"team":"Njarðvík","points":28,"probability":0.14225},{"team":"Njarðvík","points":30,"probability":0.0965},{"team":"Njarðvík","points":32,"probability":0.04325},{"team":"Njarðvík","points":34,"probability":0.011},{"team":"Stjarnan","points":4,"probability":0.001},{"team":"Stjarnan","points":6,"probability":0.0055},{"team":"Stjarnan","points":8,"probability":0.02125},{"team":"Stjarnan","points":10,"probability":0.0465},{"team":"Stjarnan","points":12,"probability":0.1},{"team":"Stjarnan","points":14,"probability":0.13825},{"team":"Stjarnan","points":16,"probability":0.1495},{"team":"Stjarnan","points":18,"probability":0.16},{"team":"Stjarnan","points":20,"probability":0.138},{"team":"Stjarnan","points":22,"probability":0.1},{"team":"Stjarnan","points":24,"probability":0.0695},{"team":"Stjarnan","points":26,"probability":0.03825},{"team":"Stjarnan","points":28,"probability":0.0215},{"team":"Stjarnan","points":30,"probability":0.0085},{"team":"Stjarnan","points":32,"probability":0.00175},{"team":"Stjarnan","points":34,"probability":0.0005},{"team":"Tindastóll","points":6,"probability":0.00075},{"team":"Tindastóll","points":8,"probability":0.00575},{"team":"Tindastóll","points":10,"probability":0.01375},{"team":"Tindastóll","points":12,"probability":0.03125},{"team":"Tindastóll","points":14,"probability":0.0575},{"team":"Tindastóll","points":16,"probability":0.086},{"team":"Tindastóll","points":18,"probability":0.1115},{"team":"Tindastóll","points":20,"probability":0.1515},{"team":"Tindastóll","points":22,"probability":0.1595},{"team":"Tindastóll","points":24,"probability":0.14075},{"team":"Tindastóll","points":26,"probability":0.116},{"team":"Tindastóll","points":28,"probability":0.07225},{"team":"Tindastóll","points":30,"probability":0.03425},{"team":"Tindastóll","points":32,"probability":0.014},{"team":"Tindastóll","points":34,"probability":0.00525},{"team":"Valur","points":2,"probability":0.002},{"team":"Valur","points":4,"probability":0.00475},{"team":"Valur","points":6,"probability":0.01525},{"team":"Valur","points":8,"probability":0.04875},{"team":"Valur","points":10,"probability":0.0695},{"team":"Valur","points":12,"probability":0.10475},{"team":"Valur","points":14,"probability":0.13875},{"team":"Valur","points":16,"probability":0.13875},{"team":"Valur","points":18,"probability":0.1355},{"team":"Valur","points":20,"probability":0.125},{"team":"Valur","points":22,"probability":0.091},{"team":"Valur","points":24,"probability":0.0595},{"team":"Valur","points":26,"probability":0.0355},{"team":"Valur","points":28,"probability":0.01975},{"team":"Valur","points":30,"probability":0.007},{"team":"Valur","points":32,"probability":0.0035},{"team":"Valur","points":34,"probability":0.00075},{"team":"Ármann","points":0,"probability":0.06275},{"team":"Ármann","points":2,"probability":0.1495},{"team":"Ármann","points":4,"probability":0.20625},{"team":"Ármann","points":6,"probability":0.21675},{"team":"Ármann","points":8,"probability":0.146},{"team":"Ármann","points":10,"probability":0.1015},{"team":"Ármann","points":12,"probability":0.06225},{"team":"Ármann","points":14,"probability":0.033},{"team":"Ármann","points":16,"probability":0.0125},{"team":"Ármann","points":18,"probability":0.0055},{"team":"Ármann","points":20,"probability":0.0025},{"team":"Ármann","points":22,"probability":0.00125},{"team":"Ármann","points":24,"probability":0.00025}],"summary":[{"team":"Fjölnir","mean_points":3.6235,"median_points":4,"lower_80":0,"upper_80":8,"base_points":0,"p_top_of_table":0},{"team":"Grindavík","mean_points":30.532,"median_points":32,"lower_80":26,"upper_80":36,"base_points":6,"p_top_of_table":0.748},{"team":"Haukar","mean_points":18.94,"median_points":20,"lower_80":12,"upper_80":26,"base_points":2,"p_top_of_table":0.01175},{"team":"KR","mean_points":20.3435,"median_points":20,"lower_80":14,"upper_80":26,"base_points":4,"p_top_of_table":0.03225},{"team":"Keflavík","mean_points":20.1515,"median_points":20,"lower_80":14,"upper_80":26,"base_points":2,"p_top_of_table":0.03125},{"team":"Njarðvík","mean_points":24.406,"median_points":24,"lower_80":18,"upper_80":30,"base_points":4,"p_top_of_table":0.116},{"team":"Stjarnan","mean_points":17.632,"median_points":18,"lower_80":12,"upper_80":24,"base_points":4,"p_top_of_table":0.01175},{"team":"Tindastóll","mean_points":21.361,"median_points":22,"lower_80":14,"upper_80":28,"base_points":4,"p_top_of_table":0.03825},{"team":"Valur","mean_points":16.8115,"median_points":16,"lower_80":10,"upper_80":24,"base_points":4,"p_top_of_table":0.01075},{"team":"Ármann","mean_points":6.199,"median_points":6,"lower_80":2,"upper_80":12,"base_points":0,"p_top_of_table":0}]}
